{
  "schema_version": "1.0.0",
  "intent_type": "ask_info",
  "intent_confidence": 0.95,
  "requires_clarification": false,
  "clarification_question": null,
  "plan": {
    "objective": "Obtenir des informations sur la fermeture.",
    "approach": "Dialogue direct",
    "assumptions": [],
    "checks_needed": [],
    "resources_to_spend": [],
    "risks": [],
    "fallbacks": [],
    "need_clarification": []
  },
  "targets": [
    "guard_archives_01"
  ],
  "runtime_actions": [
    {
      "action": "startDialogue",
      "params": {
        "target_id": "guard_archives_01"
      }
    }
  ],
  "actor_updates": [],
  "narrative_output": {
    "player_facing_text": "Le garde se tourne vers toi et repond avec prudence.",
    "mj_notes": [
      "Reveler les informations progressivement."
    ],
    "hidden_truth_updates": []
  },
  "narrative_constraints": {
    "tone": "neutral_immersive",
    "must_reflect_runtime_result": true
  }
}

